{
  "schemaVersion": "1.0.0",
  "package": {
    "name": "Cobra Tower MAX DPS v2",
    "slug": "cobra-tower-max-dps-v2",
    "type": "hunt",
    "status": "validated",
    "vocation": "Master Sorcerer",
    "levelRange": "550+"
  },
  "target": {
    "client": "MarolaOT Client",
    "bot": "vBot 4.8",
    "platform": "Windows",
    "server": "MarolaOT"
  },
  "maturity": "M6",
  "sources": [
    {
      "name": "Kolczan/Tibia-Scripts",
      "url": "https://github.com/Kolczan/Tibia-Scripts",
      "role": "community-pack",
      "commit": "52e6baaa1a32448abe88476fca53dcd466d7678e",
      "paths": [
        "otclientv8/bot/MS/cavebot_configs/[550+] Cobra Tower.cfg",
        "otclientv8/bot/MS/targetbot_configs/cobra.json"
      ],
      "license": "not-confirmed",
      "redistribution": "reference-only",
      "notes": "Original files are not committed. The installer imports the pinned files and validates their Git blob SHA-1 values."
    },
    {
      "name": "OTCv8/otclientv8",
      "url": "https://github.com/OTCv8/otclientv8",
      "role": "upstream",
      "commit": "aacfe3f1fe4bcadb5a34ff1f36263e1c96b3dd32",
      "paths": [
        "modules/game_bot/default_configs/vBot_4.8/cavebot",
        "modules/game_bot/default_configs/vBot_4.8/targetbot",
        "modules/game_bot/default_configs/vBot_4.8/vBot"
      ],
      "license": "MIT",
      "redistribution": "allowed",
      "notes": "Pinned technical upstream for the OTClient/vBot structures used by the package."
    }
  ],
  "components": {
    "cavebot": {
      "status": "validated",
      "path": "hunts/ms/500-699/cobra-tower/install/Install-CobraTower.ps1",
      "notes": "Pinned route imported at install time, NPC typo patched, markers validated and dry-run generated."
    },
    "targetbot": {
      "status": "validated",
      "path": "hunts/ms/500-699/cobra-tower/install/Install-CobraTower.ps1",
      "notes": "Pinned TargetBot imported at install time, lure raised to six and internal looting disabled."
    },
    "attackbot": {
      "status": "validated",
      "path": "hunts/ms/500-699/cobra-tower/configs/attack-profile.json",
      "notes": "Six-step MAX DPS rotation with server-aligned local cooldowns."
    },
    "healbot": {
      "status": "validated",
      "path": "hunts/ms/500-699/cobra-tower/configs/heal-profile.json",
      "notes": "Named healing and mana profile installed disabled."
    },
    "supplies": {
      "status": "validated",
      "path": "hunts/ms/500-699/cobra-tower/configs/supplies-profile.json",
      "notes": "UMP, GFB and SD named profile."
    },
    "refill": {
      "status": "validated",
      "path": "hunts/ms/500-699/cobra-tower/docs/UPSTREAM_DIFF.md",
      "notes": "Mehkesh and Fenech are validated as the main supply NPCs; the route also includes banking, selling and travel actions."
    },
    "rollback": {
      "status": "adapted",
      "path": "hunts/ms/500-699/cobra-tower/rollback/Restore-CobraTower.ps1",
      "notes": "Package-specific rollback is implemented and awaits clean-environment validation."
    }
  },
  "changes": [
    "Community sources are imported from a pinned commit instead of being redistributed.",
    "Git blob SHA-1 validation protects the source import.",
    "Menkesh is corrected to Mehkesh.",
    "A dry-run route is generated with CaveBot and TargetBot stopped before automatic hunting.",
    "AttackBot, HealBot and Supplies are separated into named package profiles.",
    "TargetBot lure count is set to six and internal looting is disabled.",
    "A package-specific backup manifest, install report and rollback are included.",
    "All modules remain disabled after installation and restoration."
  ],
  "tests": [
    {
      "name": "json-load",
      "status": "passed",
      "evidence": "The MarolaOT client loaded AttackBot, HealBot and Supplies together."
    },
    {
      "name": "local-combat",
      "status": "passed",
      "evidence": "GFB, SD and MS spells were tested locally with GM-created Cobra monsters."
    },
    {
      "name": "route-cycle",
      "status": "passed",
      "evidence": "The adapted hunt was used in the MarolaOT environment before packaging."
    },
    {
      "name": "package-static",
      "status": "pending",
      "evidence": "Awaiting pull request CI."
    },
    {
      "name": "clean-install",
      "status": "pending",
      "evidence": null
    },
    {
      "name": "package-rollback",
      "status": "pending",
      "evidence": null
    },
    {
      "name": "package-release",
      "status": "pending",
      "evidence": null
    }
  ],
  "safety": {
    "backupRequired": true,
    "rollbackRequired": true,
    "modulesOffAfterInstall": true,
    "secretsProhibited": true,
    "manualCheckpoints": [
      "Run package validation before installation.",
      "Use the generated dry-run route before the main route.",
      "Enable AttackBot, HealBot, TargetBot and CaveBot manually and in that order, with CaveBot last.",
      "Validate rollback before publishing the M7 release."
    ]
  }
}
